speaker,time,talk
Redirect,3721,"So I don't know how you got to 180. That's 15. I know, but a zero up to 15. So my, my feeling is, is that the area right here was positive 90. And then on the way back it was negative 90. So this, yeah. Right. Then my displacement would be zero because it would be like as if I never left, which would be kind of deceiving. So if you see me at time zero, I'm sitting there at Malibu, and if you see me at time 15, I'm sitting back at Malibu. Right? But in the meantime, I went 90 miles north and back 90 miles south."
Redirect,3754,"Zero. Zero, okay. Because remember, that's displacement me and should have 180 would mean up, like if I rode 90 miles south and 90 miles more south. Right? But I didn't, I went 90 miles north and 90 miles south. That's what the negative means. South. Good. Otherwise everything looks good."
Evaluation,3781,Yeah.
Evaluation,3793,"It. Right? Agreed. Because it's, it's different. Yeah. So use area instead. Same. So I"
Redirect,3807,What are you guys doing?
Redirect,3810,You see it? What are you doing? So much? Work. For what?
Redirect,3833,"Right. Oh, I see. Yeah. But you know what? I think you did the same thing. So, right. Okay. So"
Redirect,3840,"Man, since I left, it's been nothing. But what is this? <laugh>. You guys have a calculator? Come on, you guys just make him do it."
Redirect,3852,"Us. You guys are killing me. You're doing everything right except calculations. Okay, this, okay, hold on. Remember this was 90, right?"
Redirect,3867,This is zero.
Redirect,3870,Not you never quits. Never quits. This one right here is negative six. Remember?
Redirect,3877,"And then this one right here was like negative 24. Which one are we doing? Oh, but I actually want eight to 15. If we wanna use anti derivatives, we have to use the equation for this piece. See, you're now using the equation for this piece. For this piece. Same as the same mistake you made before. So what's the equation for this piece? It's constant. It's constantly what?"
Redirect,3905,"So do this anti derivative negative to 15, 12."
Redirect,3910,Negative 12. Sorry.
Redirect,3913,12 dt. Right? And what's the anti derivative? Negative 12.
Redirect,3916,"12 T. Negative 12 T. And then we're gonna do that plug in 15 there. And Darren, now don't use a calculator cuz that you could actually do without a calculator. That's all you gotta do. All right. Does that make sense? You see it also, this one, all this mess was supposed to be negative six because it was that area. It was seven to eight. So we got the right equation. But <laugh>, that didn't turn out. You were off by only eight. That was pretty good. And it was supposed to be negative six, right? Because it was supposed to match up that area. Does that make sense? Yeah. All right. Here, I don't know who this is. Wait, what happened here?"
Evaluation,3959,"Oh, that's right."
Evaluation,3963,Where are we at? That's where you are?
Evaluation,3965,"Okay. Okay. Are you stuck or, um, you have all the information you need. Did you get, oh, you guys are really going for it? Yeah. Did you get 'em? One 16? Sounds right. It's not, I don't know. You know what? We can do us plug in five and see if we get 90. Is that what you did?"
Evaluation,3996,And I get a 500.
Probe,4013,Right. What did you do? How did you get 160?
Probe,4031,Probably right?
Probe,4039,I don't know. It's too hard for me.
Probe,4045,"It's hard. I didn't say. Okay. Yeah, you're right. Yeah. Uhhuh. <affirmative>. Okay. And you solve for c that and you solve for c and we solve for c. So this is"
Probe,4061,Just kidding. 2 42.
Probe,4065,"Yeah, you're right. Okay, let's call it five. Square is twenty five two negative two 50. Oh yeah. Yeah, it comes out to 90. Good. Sorry. I'm sorry. <laugh>. Skying over here. Good."
Redirect,4084,"You can always put miles. Okay, hold on. You gotta finish now. So this is seven, eight and this is the anti derivative. So now you gotta go eight and seven and subtract. Okay. Right? Mm-hmm."
Extend student thinking,4122,"Yeah, you're right. But here, the only thing is you got the hard part is finding the C plus Cs. Remember how we did that before? When we and the piece wise and we have to solve for the pluses by using like the, the, we do have a lot of points on the, we have every point on the position function. So it's kind of easy to solve C cuz you can just use any point you want cuz you have that whole table full of, of values you can use for each piece. Does that make sense? But it's annoying though. I didn't, I guess I didn't, I mean you all are doing great. I didn't think we're even gonna get this far, but I have a follow up. That might be what is he doing? Good. Hey, that's all that matters. As long as there's someone in the groove that will do the work, you enjoy it. Well the first one's easy. This one's easy, by the way, this is zero plus C, but this is during the time when I'm in Santa Barbara. So this one is obviously No 84. 80"
Evaluation,4177,"Something. Not Santa Barbara. Dude, you guys are crushing you. Great job. It's like a magic trick. <laugh>."
Evaluation,4212,"Okay. Here. No, I'm just kidding. Go sit down and take a break. You're brilliant. Here. Take this anyway. Just take it for later but later. By later. I mean maybe tomorrow. Don't, you don't have to, you don't even have to do it. I, I'm just, I'm amazed how far y'all have gone. Um, there's more no drawn to scale. Okay. What does it say in total? That's the last problem. So wait, you're on one 18. Okay. Pretty much. This is a short"
Evaluation,4268,"Good job Julia. Good job Oliver. Brilliant, brilliant Mr."
Extend student thinking,4286,"Yeah, you are. That's brilliant. Uh, we have to find the slope. Okay, that's the point. That's a good point. Uh, um, no, when it's at seven it's still zero actually. And then here it's negative 12. Oh, okay. So are you gonna use that to find the slope then?"